{
  "demanda": "003-marcador-duplicado",
  "phase": "done",
  "spec_dir": "specs/003-marcador-duplicado",
  "brief": "Corrigir o marcador V32_UI_END emitido 2x pelo builder e remover a exceção nominal KI-1",
  "branch": "feature/003-marcador-duplicado",
  "refinement": {
    "status": "approved",
    "approved_at": "2026-08-25",
    "notes": "aprovado pelo usuário no chat"
  },
  "specify": {
    "status": "approved",
    "approved_at": "2026-08-25",
    "notes": "aprovado pelo usuário no chat, com emenda G2 incorporada"
  },
  "plan": {
    "status": "approved",
    "approved_at": "2026-08-25",
    "notes": "aprovado pelo usuário no chat"
  },
  "tasks": {
    "status": "approved",
    "approved_at": "2026-08-25",
    "notes": "aprovado pelo usuário no chat"
  },
  "red": {
    "status": "proven",
    "commit": "214d3e44360861a350780d2cbadda27c91cdef3d",
    "gates": [
      "G1"
    ]
  },
  "implement": {
    "status": "done",
    "waves_done": [
      1,
      2,
      3
    ],
    "pending": [
      "W4"
    ]
  },
  "validate": {
    "status": "done",
    "conformance": "13/13 (100%)",
    "notes": "aceite de intenção do PO: não encontrei objeção; expansão b7a10f6 ratificada nominalmente pelo usuário no portão"
  },
  "pr_url": "https://github.com/oflavioc/quickscan-secops-v32-phase5-dev/pull/13"
}
