{
  "demanda": "009-leitura-do-relatorio",
  "phase": "red",
  "spec_dir": "specs/009-leitura-do-relatorio",
  "brief": "Legibilidade da entrega ao cliente na tela de resultados: quebra da nota da jornada, redundancia entre narrativa e bullets, glossario do contexto tecnologico na secao de resultados, ordem canonica das 9 secoes, posicao da base de evidencia, regra de bloco de ausencia e o defeito de mensagem unica em ui_target_v32.js:166. Itens 4/6/8 saem para a 010 e o item 1 para a 011 (divisao aprovada em P1).",
  "branch": "feature/009-leitura-do-relatorio",
  "refinement": {
    "status": "approved",
    "approved_at": "2026-08-27",
    "notes": "aprovado pelo usuario no chat ('Sigo as recomendacoes') apos rodada 1 do product-owner; adota P1-P15 pelas recomendacoes. P1: divisao em 3 demandas (009 = itens 2,3,5,7,9 + regra de bloco de ausencia + defeito ui_target_v32.js:166; 010 = itens 4,6,8; 011 = item 1). P2: rota R1+R4, Porta B no engine RECUSADA. P5: FortiNAC/FortiSIEM fora de escopo. P7 sub-pergunta: NAO suprimir o .why congelado — Camada 1 permanece apenas lida. P14: ordem do PDF em demanda propria. P15: sessao real de 2026-08-27 nao localizada (QuickscanData/clients vazio, D: inacessivel) — vao entre camadas fundamentado no source, nao reproduzido; pendencia declarada da 010. Desvio de trilha: product-owner pinado em model:fable executado em Opus por indisponibilidade de creditos."
  },
  "specify": {
    "status": "approved",
    "notes": "aprovada pelo usuario no chat ('Aprova a spec com C13'). spec.md (454 linhas): 17 criterios C1-C17 -> gates D009-* em suite nova tests_009_leitura.js (jsdom, sem Chromium) + campanha tests_009_mutants.js; 19 mutantes previstos. DUAS RATIFICACOES do proprietario registradas na propria spec: (1) troca de ancora — rota A, esta spec substitui a §8 da diretriz selada da 5.2 e P52-TGT1 e reancorado em iT>iE e iC===iT+1, §8 segue citavel como historico; (2) ampliacao C13 — as 3 capabilities com landscapeEnabled=false (soc-governance, soc-staffing, soc-skills, 5 das 15 perguntas) entram, e o defeito de ui_target_v32.js:166 passa a ter 4 estados especificados. Verificado pelo orquestrador: so P52-TGT1 (tests_p52_layout.js:229) dependia da posicao absoluta do alvo. Duas fixtures novas locais a suite sao necessarias para C11/C12. Saem no mesmo PR: USER_GUIDE.md §8.1 e o comentario de fixtures_p52.js:16-22 (deriva pre-existente agravada por esta demanda).",
    "approved_at": "2026-08-27"
  },
  "plan": {
    "status": "approved",
    "notes": "aprovado pelo usuario no chat ('Aprovo'). plan.md do tech-lead (243 linhas): 9 waves por dependencia real (0-ambiente npm ci / 1-fixtures / 2-gates+red / 3-implementacao 5 modulos [P] / 4-consumidor+docs / 5-rebuild / 6-verde+campanha / 7-repin unico / 8-validacao). 6 modulos, dono unico por arquivo, todos ui-engineer exceto os tests_* que sao do qa-engineer. NENHUM bridge novo (__P52 ja registrado ganha so um metodo); registro de patch-points vazio; boundary mais alta e generated+registry, nenhum protegido tocado; sem PARADA. Mutantes renomeados D009-M1..M19 por colisao de nome com M1 global da demanda 003; tests_009_mutants.js carrega 18 (o M3 da spec segue sendo P52-M3 no harness p52). Verificado pelo orquestrador no source: (a) P52-HOME1 usa js.split('P52_CAP_HELP')[0] como prefixo de varredura — capHelpLine tem de ficar DEPOIS do literal ou o gate enfraquece silenciosamente; (b) o buraco na numeracao visivel e PRE-EXISTENTE (data-p52-order = i+1 sobre a ordem completa, secao ausente nao renderiza) — a ordem nova so o move de 4 para 8; (c) #ux-target renderiza SEMPRE (ui_target_v32.js:96-101), logo a prosa de B4 na spec esta errada, mas nenhum gate D009-* a exercita e a spec aprovada nao foi alterada. RISCO DE AMBIENTE: Chromium ausente nesta maquina e known_issues.json sem excecoes nominais — as campanhas de mutacao p51/p52 so executam no CI (wave 8).",
    "approved_at": "2026-08-27"
  },
  "tasks": {
    "status": "approved",
    "notes": "aprovado pelo usuario no chat ('Aprovo'). tasks.md do tech-lead (166 linhas): 23 tarefas T001-T023 em 9 waves — 10 qa-engineer, 6 ui-engineer, 4 build-engineer, 2 doc-writer, 1 product-owner. Wave 0 = npm ci (tarefa, nao pressuposto); wave 2 = red commitado ('test(009): red — <gate>'). Serializacoes nomeadas: ui_v32.js sai da wave 3 e vira T013 sozinho na wave 4 (depende de T008 publicar capHelpLine e e o modulo que dispara mais campanhas — diff isolado torna o resultado atribuivel); T008 e T009 viraram tarefa unica cada por R5 §3; expected_suites.json aparece em T003 e T017 e nunca [P]. Tipagem contra o obvio, auditavel: T004-T006 refactor (reancoram oraculos existentes, 45/0 e 55/0 provam que nada nasce ou morre) e T018 chore (campanha de mutacao e instrumento; a prova e o KILL de T019, nao um red). Nenhum tdd_waiver previsto. ESCALADA DECLARADA E NAO AMPLIADA: .v32-decl-row e estilizada (ui_v32.css:8, display:flex + flex-wrap), e ui_v32.css NAO consta da lista de Contratos da spec aprovada (0 mencoes). A frase de glossario de C8 entrara como item de flex, quebrando para baixo. Passa em todos os gates D009-* (jsdom, nenhum mede geometria). O tech-lead NAO criou tarefa para ui_v32.css — seria 7o arquivo de produto no PR sem spec. Verificado pelo orquestrador no source. Se o rito visual da Fase 6 recusar a colocacao, volta como ampliacao com ratificacao do proprietario.",
    "approved_at": "2026-08-27"
  },
  "red": {
    "status": "proven",
    "commit": "39502880de3b88f4928c1dc1a5cf369f5a34b520",
    "gates": [
      "D009-ORD1",
      "D009-ORD2",
      "D009-DOM1",
      "D009-NXT1",
      "D009-GLO1",
      "D009-GLO2",
      "D009-UNS1",
      "D009-UNS3",
      "D009-UNS4",
      "D009-ABS1",
      "D009-LEG1",
      "P52-LAY3"
    ],
    "notes": "T002-T007 executados em 2026-08-28. Medido: d009 4 PASS/11 FAIL de 15; p52layout 44 PASS/1 FAIL de 45 (censo de ids identico ao de HEAD - 45 ids, mesma ordem, nenhum gate nasce ou morre; a unica FAIL e P52-LAY3, que consome as constantes reancoradas). As outras 13 suites do stage suites seguem 0 FAIL. QUATRO gates D009 nascem VERDES de proposito, por serem criterios de PRESERVACAO e nao de mudanca (C5 INV-7, C7 ramo insuficiente, C11 frase de S3, C16 base de evidencia): D009-DOM2, D009-NXT2, D009-UNS2, D009-EVB1 - declarados no cabecalho de cada gate e discriminados pelos mutantes D009-M6/M8/M13/M18-M19 na wave 6. NAO EXECUTADO, com motivo: p52chromium (55/0) - binario do Chromium ausente nesta maquina (playwright resolve C:/Users/usuario/AppData/Local/ms-playwright/chromium-1234/chrome-win64/chrome.exe, que nao existe); reancoragem de CANON/BLOCKED conferida por leitura e censo de ids, execucao agendada para o job visual (T022). NAO EXECUTADO, com motivo: campanha p52 (par P52-M3 x P52-TGT1) - o harness reconstroi o HTML gerado e a arvore precisa estar limpa (check_mutation.py:41-46); rodar agora arriscaria sujar o artefato generated as vesperas do red. Conferido sem executar: o `find` de P52-M3 casa 1x byte a byte no source atual, logo o mutante continua aplicavel; o KILL e provado em T019. DIVERGENCIAS DE SPEC ENCONTRADAS (nao resolvidas em silencio, ver relatorio do qa-engineer): (1) C10 x C13 - a clausula 'zero .ux-tgt-en com a frase de NONE' e anterior a ampliacao C13 ratificada, que manda S4 MANTER a frase; o gate afirma a clausula POR PRATICA (so as S2), nunca em bloco; (2) C5 - a comparacao byte a byte de .jn-narrative com paragraphs ignora o mapa de apresentacao publico da 5.2 (P52_COPY: 'Mandato e objetivos' -> 'Direcionamento e objetivos'), que ja existia antes desta demanda; os oraculos de TEXTO aplicam __P52.copyMap() no lado TELA - sem isso, tres asercoes NEGATIVAS (UNS1/UNS3/UNS4) passariam vacuosamente; (3) C8/B13 - nao existe hoje capability declaravel sem verbete (as 22 com landscapeEnabled:true tem verbete), entao o ramo e inalcancavel e o gate o guarda pela invariante que o torna vazio, falhando se alguem criar uma. Desvio de trilha: qa-engineer pinado em model:fable executado em Opus por indisponibilidade de creditos."
  }
}
