{
  "demanda": "024-sete-defeitos-do-relatorio",
  "phase": "done",
  "spec_dir": "specs/024-sete-defeitos-do-relatorio",
  "branch": "feature/024-sete-defeitos-do-relatorio",
  "brief": "Corte decidido pelo proprietario em 2026-10-19: congelar o backlog de instrumento e limpar os defeitos que o CLIENTE VE no relatorio. Sete candidatos, todos da mesma superficie (secao de apoio e cards): EA-69 rotulos do MAP sem o acronimo que os outros trazem; EA-73 apoio Fortinet decora o card de PRIORIDADE e so quando calha de casar; EA-74 o contador de gaps promete a sessao e mede a secao; EA-75 produto que serve duas capabilities aparece duas vezes e a alavancagem some; EA-79 sem contexto declarado a secao mostra duas leituras sem dizer que sao a mesma; EA-80 a supressao da curadoria deixa a secao com titulo e nada embaixo; EA-81 em modo legado sob arbitragem o catalogo de icones duplica e fica oculto. RECONFIRMAR CADA UM ANTES DE QUALQUER DESENHO: ha suspeita medida de que o EA-79 ja foi executado e fechado pela demanda 023 e que so a linha de status nao acompanhou - corrigir o que ja esta corrigido seria o pior desperdicio possivel. Os 27 achados de instrumento ficam DECLARADOS, nao ignorados, e nenhuma frente nova de instrumento abre sem pedido do proprietario. DESFECHO: zero conserto de produto. A demanda entrega a constatacao MEDIDA de que nao ha defeito visivel a corrigir, dois achados convertidos em divida declarada com a razao, e cinco linhas de registro deixando de mentir.",
  "refinement": {
    "status": "done",
    "approved_at": "2026-10-19",
    "notes": "REFUTADA NO PORTAO DA FASE 0, precedente nominal da demanda 020. A reconfirmacao (fix-finding §1) derrubou a demanda antes do enquadramento: CINCO dos sete NAO REPRODUZEM, ja corrigidos antes: EA-69/EA-73/EA-74 pelo fix-finding fix/sessao-v329-onda1 (PR #103, merge 7bee758, 2026-09-27); EA-75 pela 022 (errata E2); EA-79 pela 023, e continuavam `aberto` so porque ninguem atualizou a linha de status. EA-69: rotulos com acronimo entraram na P52_COPY com ratificacao nominal do proprietario de 2026-09-27 — conferido pelo orquestrador no fonte E no artefato construido. EA-73: removido. EA-74: as DUAS metades. EA-75: resolvido em forma emendada pela 022, com a reindexacao recusada por custo medido (55 assercoes em 5 suites). EA-79: executado pela 023 por uma QUARTA rota, nao pela rota C que o proprio encaminhamento anunciava — conferido pelo orquestrador (hasSubstituteV32, temProdutoPublicadoV32). Os DOIS que reproduzem nao sao defeito no relatorio que o cliente recebe. EA-80: INVERSAO DE PRODUTO achada na reconfirmacao — repor os blocos quando a curadoria suprime tudo RE-EXIBIRIA exatamente o que o operador acabou de excluir; a secao com o aviso E a leitura correta daquele estado, porque supressao e decisao de quem conduz a sessao e nao vao do software. Fecha por declaracao, com errata na spec da 010, zero linha de produto. EA-81: copia morta em no oculto — o cliente nao ve e o papel le so os cards; divida de instrumento declarada. ZERO LINHA DE CODIGO. O que resta e registro. APROVADO PELO PROPRIETARIO no chat em 2026-10-19 ('Vamos de (a), release com a tag') — aprovacao do portao da Fase 0 com a refutacao, e escolha da rota de selagem. CORRECAO DO DOC-WRITER ao registro: EA-80 fica `transferido` e nao `resolvido` — o rito de status do backlog (BACKLOG.md:63-66, demanda 012) diz que migracao para design-decisions.md e `transferido`, e `resolvido` exige fix com commit. E no EA-79 a rota C ERA a estrutural e foi feita (e a propria 023); o que a 023 fez foi executa-la por uma quarta rota TECNICA, nenhuma das tres da tabela do achado. Contagem medida apos D2: 27 abertos (eram 33), 53 resolvidos, 4 refutados, 1 transferido."
  },
  "tdd_waiver": {
    "motivo": "Demanda REFUTADA no portao da Fase 0 (precedente nominal: 020): nao houve gate a escrever porque nao houve comportamento a implementar — cinco dos sete achados ja estavam corrigidos e os dois restantes nao sao defeito visivel ao cliente. A R3 exige red provado para tarefa feature/fix; aqui nao existe tarefa, a demanda nunca chegou a tasks. Waiver e o registro honesto disso, e o compliance-audit o LISTA a cada execucao: rastro, nao obstaculo. Nenhum commit de codigo nesta demanda.",
    "data": "2026-10-19"
  },
  "validate": {
    "status": "done",
    "conformance": "NAO SE APLICA, e a razao e estrutural: conformance mede implementacao contra SPEC, e esta demanda nao teve spec — refutada no portao da Fase 0, nunca avancou para specify. O equivalente honesto do 100% aqui e: NENHUM commit de codigo, produto byte-identico, cinco achados deixando de mentir no registro, dois convertidos em divida declarada com a razao.",
    "aceite_po": "NAO ENCONTREI OBJECAO — product-owner, 2026-10-19, em Opus 5 (modelo fora do habitual; registrado). O veredito E a refutacao: a reconfirmacao fix-finding §1 derrubou a demanda antes do enquadramento, e o PO recomendou fecha-la sem codigo (D1) com as decisoes D2 a D7. Campo nomeado `aceite_po` e nao `aceite_de_intencao` DE PROPOSITO: o EA-88 mediu que a coorte com o nome que NOMEIA O AUTOR tem veredito canonico em 5 de 5, e a coorte com o nome que so nomeia o objeto tem 4 de 5 fora de forma. Esta demanda aplica a licao que ela mesma ajudou a registrar.",
    "aprovacao_de_fase": "PROPRIETARIO, no chat, 2026-10-19: 'Vamos de (a), release com a tag'. E outra coisa que o aceite do PO (D3) e esta em campo proprio por isso."
  },
  "pr_url": "https://github.com/oflavioc/quickscan-secops/pull/110"
}
