{
  "demanda": "012-status-backlog",
  "phase": "done",
  "spec_dir": "specs/012-status-backlog",
  "brief": "Status legível por máquina no .claude/BACKLOG.md, para o compliance-audit listar achados abertos como já faz com os tdd_waivers — hoje o status é prosa ('**Status: aberto.**') e nenhuma máquina o lê",
  "branch": "feature/012-status-backlog",
  "refinement": {
    "status": "approved",
    "approved_at": "2026-08-28",
    "notes": "aprovado pelo usuário no chat ('Prossiga') após rodada 1 — 4 recomendações aceitas ('Aceito as 4 recomendações'): Markdown canônico com gramática fechada; 4 estados (aberto/resolvido/refutado/transferido); audit lista abertos com ok e reprova só violação de forma; pacote completo com migração do EA-1"
  },
  "specify": {
    "status": "approved",
    "approved_at": "2026-08-28",
    "notes": "aprovado pelo usuário no chat ('Aprovadi' — typo evidente de 'aprovado', intenção inequívoca no contexto do portão; registrado verbatim por ser trilha de auditoria). Gates BS-1…BS-5, gramática T1, parse T3-T5. Parecer do PO sem bloqueantes; 4 não-bloqueantes de cobertura (estados resolvido/transferido não provados como aceitos; ramo 'nenhum aberto' não asserido; cenário de posição violada ausente; mensagem de FAIL deve citar o prefixo reservado) endereçados ao plan/tasks/Fase 4"
  },
  "plan": {
    "status": "approved",
    "approved_at": "2026-08-28",
    "notes": "aprovado pelo usuário no chat ('Aprovado'); 4 waves sequenciais (W1 red, W2 green, W3 mutantes, W4 validação); os 4 não-bloqueantes do PO viraram cenários nomeados PO-1…PO-4b; política de repin-por-commit com tabela nominal R1–R5 (aprendizado da 008, que previu 1 repin e teve 3); boundary confirmado limpo, sem PARADA R6"
  },
  "tasks": {
    "status": "approved",
    "approved_at": "2026-08-28",
    "notes": "aprovado pelo usuário no chat ('aprovado'); 10 tarefas T001-T010 em 5 waves; repins R2-R5 como tarefas próprias do build-engineer; PO-1…PO-4b nomeados dentro de T002/T006; nenhuma tarefa [P] (dependências lineares, justificado); tipagem defendida (T002 feature = gate novo com red real; T004 doc = green de gate já red-provado)"
  },
  "red": {
    "status": "proven",
    "commit": "13f4bb4965c3ff5be1226cf0785170211e25ebc1",
    "gates": [
      "BS-3"
    ],
    "notes": "Red natural commitado em 2026-08-28 (T002): a seção backlog reprovou o .claude/BACKLOG.md como estava, sem fixture — 0 PASS · 1 FAIL, exit 1, nomeando o EA-1. 14/14 cenários adversariais conformes em worktree efêmera. M-BS3 prova o red reprodutível. Ressalva de processo: a mecânica T8 previa o CI vermelho do commit red como prova, mas push de feature/* não dispara o verify.yml — a R3 §4 foi cumprida por commit + saída registrada"
  },
  "implement": {
    "status": "done",
    "waves_done": [
      0,
      1,
      2,
      3,
      4
    ],
    "pending": [],
    "notes": "Green em ebceb70 (1 PASS · 0 FAIL, exit 0, EA-1 listado). Campanha T006: 6/6 mutantes mortos, 2/2 sondas conformes; sondas provaram que a auto-exclusão R10 §10 vive no escopo de bloco, não na indentação por acidente. Repins R1-R5 executados: 0246dfd, 502fbdb, 3ca3320, c3c6e55, 692e458 — previsão de 5 cumprida com desvio zero, primeira demanda da série sem desvio"
  },
  "validate": {
    "status": "done",
    "conformance": "22/22 (100%)",
    "notes": "T007: pipeline completo 14 PASS · 0 FAIL; compliance-audit 13 PASS · 0 FAIL (8 seções); baseline 202/202. spec-validate 22/22 sem iteração. CI: run 33219366036 (dispatch) verde e run 33220644653 (pull_request) verify+visual success. T008 aceite do product-owner: 'não encontrei objeção', com as 4 decisões da rodada 1 conferidas e os 4 não-bloqueantes dele executados como PO-1…PO-4b. Achado EA-2 encaminhado (falso positivo do grep tdd_waiver na seção waivers), com nota de guarda: não sanar editando a prosa do brief"
  },
  "pr_url": "https://github.com/oflavioc/quickscan-secops/pull/25"
}
