{
  "demanda": "025-curadoria-transacional",
  "phase": "implement",
  "spec_dir": "specs/025-curadoria-transacional",
  "branch": "feature/025-curadoria-transacional",
  "brief": "A curadoria do relatorio (sexta chave canonica da sessao, demanda 019) entra de fato no ciclo de vida da sessao: validar sem aplicar; candidato, commit atomico e snapshot ANTES de qualquer escrita, inclusive a AUSENCIA da chave (INV-8: o documento basta para reconstruir o resultado); Nova sessao limpa o owner; gates de roundtrip real que importam. Origem: EA-91/EA-92 (auditoria externa Codex 2026-10-20, refutacao adversarial 2026-10-25 em docs_phase5/auditoria_codex_2026-10-20/refutacao_adversarial_2026-10-25.md §3), com os adjacentes EA-105..EA-114. Decisao do proprietario 2026-10-25: corrigir o produto antes de selar a v3.2.11.",
  "refinement": {
    "status": "approved",
    "approved_at": "2026-10-27",
    "notes": "Fase 0 aberta em 2026-10-25 pelo orquestrador; product-owner refina sobre a sintese da refutacao (secao 3) e os verbetes EA-91/92/105..114 do BACKLOG (branch de registro eec8370, PR #112 em aberto). Branch nasce de eec8370, nao da develop, para o BACKLOG nao conflitar; rebase sobre a develop apos o merge do #112. PORTAO APROVADO PELO USUARIO no chat em 2026-10-27 (AskUserQuestion): 'Aprovado em bloco (Recomendada)' — as seis recomendacoes do PO (P1 recusar {}/{decisions:{}}/null; P2 Reiniciar limpa a curadoria e o dialogo a nomeia; P3 toggle-back volta a ausente, unset no bridge; P4 previa/aviso mostram curadoria e sessionHasContent conta curadoria; P5 prioLimitHit e draft entram, draft em wave propria severavel; P6 D025-INV8 novo + errata de titulo do D019-INV8 + errata na spec 019 C3/C10) viram decisao. AUTORIZACAO NOMINAL §29.4 (R6 §5) dada pelo usuario na mesma rodada: 'Autorizo os quatro (Recomendada)' — ui_session_v32.js, ui_ux_v32.js, tests_session_m48.js e ui_v32.js, so para a 025, com repin e trilha 'Identidade anterior' nos pins inline legados."
  },
  "specify": {
    "status": "approved",
    "notes": "spec.md do tech-lead (2c47545; Fable 5.1) + revisao de intencao do product-owner (Fable 5.1, 2026-10-27): 'nao encontrei objecao'; 12 edicoes marcadas [PO 2026-10-27] — vao de poder fechado (TRX2(b') + M22: rollback com sessao 'nada declarado'), sub-caso de C3 para chave desconhecida dentro de reportCuration (M23; extensao de P1 — ERR-2, decidida pelo PO na Fase 1, levada ao usuario junto com a spec), textos de P2/P4/recusas aprovados, queda da guarda && snap.curadoria confirmada (ERR-1), EA-110 corrigido pela 025 (E8). Portao: aprovacao literal do usuario pendente. PORTAO APROVADO PELO USUARIO no chat em 2026-10-27 (AskUserQuestion): 'Aprovado, com a extensao (Recomendada)' — spec integral, inclusive ERR-2/M23.",
    "approved_at": "2026-10-27"
  },
  "plan": {
    "status": "approved",
    "notes": "plan.md do tech-lead (Fable 5.1, 2026-10-27): 10 waves (W0 pre-condicoes: merge #112/#113 pelo usuario + rebase ANTES do red; W1 red; W2 bridge; W3 ui_session; W4 ui_ux; W5 ui_v32 severavel; W6 editor; W7 docs/erratas; W8 registros + harness de mutantes; W9 validacao); um dono por modulo (core-engineer nos quatro modulos de estado, ui-engineer no editor, qa nas suites, doc-writer docs, build-engineer bridges/pins inline/pins/rebase); harness de mutantes em W8.3 com a tabela estado-do-mundo viajando no red (precedente 019/021-023, D4 da 013); 17 repins previstos; p51/p52 so fecham no job visual (KI-3); red esperado d025 1/16 PASS, m48 94/97. Portao: aprovacao literal do usuario pendente. PORTAO APROVADO PELO USUARIO no chat em 2026-10-27 (AskUserQuestion): 'Aprovado (Recomendada)'.",
    "approved_at": "2026-10-27"
  },
  "tasks": {
    "status": "approved",
    "notes": "tasks.md do tech-lead (Fable 5.1, 2026-10-27; de068cb): 51 tarefas T001-T096 em W0-W9, tipagem auditavel (6 feature, 1 fix, 8 doc, resto chore), [P] so em medicoes/prototipos em clone efemero, estado do mundo M1..M23, serie de 17 repins, 11 pontos de PARADA, provas mecanicas das erratas aditivas testadas. Plano recebeu nota aditiva da Fase 3 (coluna suites vermelha de T013 a T084; INV8(d) fecha na W7; CM1 falso sobrevivente T030-T040; R0 unico; SHAs pos-rebase). W0.2/W0.3 ja executadas (rebase sobre da71759). Portao: aprovacao literal do usuario pendente. PORTAO APROVADO PELO USUARIO no chat em 2026-10-27 (AskUserQuestion): 'Aprovado — abrir o red (Recomendada)'; P5-draft mantido.",
    "approved_at": "2026-10-27"
  },
  "red": {
    "status": "proven",
    "commit": "b20b20b1e2e3e0eb8208d1dc0dcbcd637494c5fb",
    "gates": [
      "D025-VAL1",
      "D025-VAL2",
      "D025-CAN1",
      "D025-TRX1",
      "D025-TRX2",
      "D025-AUS1",
      "D025-INV8",
      "D025-NOP1",
      "D025-NEW1",
      "D025-RST1",
      "D025-TRN1",
      "D025-TRN2",
      "D025-PRV1",
      "D025-UNS1",
      "D025-GAT1",
      "D025-DOC1",
      "S50",
      "S30",
      "S31-S32"
    ],
    "notes": "RED PROVADO pelo qa-engineer (Fable 5.1): T013 755b8e2f23d72dc90dbfd872285bbb7fe22603cb (tests_025_curadoria_sessao.js + red-025.md) e T015 b20b20b1e2e3e0eb8208d1dc0dcbcd637494c5fb (reancoragens em tests_session_m48.js sob §29.4 de 2026-10-27; red.commit). Medido em 2026-10-27 e reexecutado em 2026-10-30 com vereditos byte-identicos: 'D025 CURADORIA SESSAO: 1 PASS · 15 FAIL de 16' e 'SESSION 4.8: 94 PASS · 3 FAIL de 97' (S50, S30, S31-S32). VERMELHO NA ARVORE: 15 gates D025-* + S50/S30/S31-S32. VERDE DECLARADO (regressao; poder so no harness de W8): D025-GAT1, S69(b). Divergencias declaradas em red-025.md D1-D7, nenhuma ajustada; D3: INV8(a)(b)(c) nascem verdes hoje (celula 'nascem vermelhos' da spec larga em (b)(c); INV8 reprova por (d)) — errata tardia classe (c) a decidir pelo orquestrador no fecho. Prototipos P1 (seletor real via #ses-import + File sintetico: SIM) e P2 (falha sintetica: SIM) em worktree efemera, removida. Nenhuma PARADA."
  },
  "implement": {
    "status": "in_progress",
    "waves_done": [
      0,
      1,
      2,
      3,
      4,
      5,
      6,
      7,
      8
    ],
    "pending": [
      "W9 validacao: errata classe (c) autorizada pelo usuario em 2026-10-30 (C7 'nascem vermelhos'; texto F-tardio; validate(undefined)->[] ratificado), spec-validate, relatorio final + E8 no BACKLOG, pipeline completo, push, PR"
    ],
    "notes": "W1 fechada em 2026-10-30. R1/R2 absorvidos num repin unico apos T017 (os dois commits do red ja estao em sequencia; reordenar exigiria rebase, PARADA 9) — divergencia de granularidade declarada. W2-W8 fechadas em 2026-10-30: e11fd05 (bridge) d8518e0 (sessao) 17683b6 (ux) a0a879a (editor) 4ef94ba (draft) 01e7067/6cace4c/19f4d45 (docs E4-E6, E1-E2) 8ce520a (E3) 97f08d8 (pins inline §29.4) 5f2b99a (E7) f892db1 (harness d025 23/23 DETECTADO + registros). d025 16/16, m48 97/97, p50core 65/65. Repins R3-R14 (R8-R10 e R12-R13 fundidos, declarados). Aceite de intencao do PO (Fable 5.1, 2026-10-30): 'nao encontrei objecao', condicionado a prova verde — O1-O10 para o relatorio final."
  }
}
