{
  "demanda": "026-decisao-unica-do-apoio",
  "phase": "done",
  "spec_dir": "specs/026-decisao-unica-do-apoio",
  "branch": "feature/026-decisao-unica-do-apoio",
  "brief": "Contrato unico de decisao de apoio: a oferta por produto nasce uma vez em ui_curation_v32.js (dono do estado, __CURATION) reconciliando a Camada 1 (MAP) com o motor contextual; tela (ui_p52_support_v32.js), editor e papel consomem. O papel preserva qualificador, acao, variante, escopo e origem. Origem: auditoria externa de 2026-10-31 (QS-01 cards contradizem o motor; QS-02 PDF perde qualificadores) e EA-76 (segunda fonte do ofertaDoMotor, 'conserto e demanda futura'). Microfase 01 do plano de correcao de 2026-10-31.",
  "refinement": {
    "status": "approved",
    "notes": "Fase 0 aberta em 2026-10-31 pelo orquestrador (Fable 5.1) a partir do prompt da microfase 01 (Downloads/Plano_de_correcao_e_prompt_QuickScan_2026-10-31.md §2) e da auditoria (Auditoria_QuickScan_SecOps_SOC-CMM_2026-10-31.md). Reproducao no HEAD 9509e4b por sonda jsdom (anexos/sonda-leitura.js, anexos/cenarios/*.json): C1, C2, C4, C5, C7 defeitos reais; C3 abstencao do engine (lacuna classify x suppressedByPlatform, frozen) -> hipotese condicionada; C6 decisao registrada (022 E2) -> variante como titulo, nao card; C8 decisao registrada (023 E1). Refutacao adversarial e painel de tres desenhos (A/B/C) julgado por tres lentes: vencedor B (fonte unica na curadoria), sintese em anexos/desenho-sintese.md. Decisoes D-1..D-9 do §10 do desenho adotadas na recomendacao do tech-lead, decididas pelo orquestrador sob a instrucao do proprietario de 2026-10-31 (prompt da microfase 01); ratificacao literal pendente no PR. PORTAO DA FASE 0: decidido pelo orquestrador sob a instrucao do proprietario de 2026-10-31 (prompt da microfase 01); ratificacao literal pendente no PR. refinement.md (product-owner, Fable 5.1) + 4 verbetes em CONTEXT.md:247-305; critica de completude aplicada (itens 1.7, 3.3, 4.6, 4.10, 6.1-6.4).",
    "approved_at": "2026-10-31"
  },
  "specify": {
    "status": "approved",
    "approved_at": "2026-10-31",
    "notes": "spec.md do tech-lead (Fable 5.1, 2026-10-31): 8 criterios C1..C8 -> 3 gates D026-REC1 (a)-(i), D026-PAP1, D026-LEG1 (a)-(g); 6 mutantes D026-M1..M6; secao Reancoragens (D022-M10 muda de arquivo em 4 toques; comentarios-trilha E13); cross-check por leitura das specs seladas (REV B sha 4f1583c7 conferido) e boundary em tres fontes: classe mais alta tocada = produto/generated. Critica de completude aplicada (alinea (i) placeholder de familia; condicao nas portas de saida; escopo do FortiRecon em PAP1; C7 veto FortiEndpoint + elig SOCaaS; dividas declaradas; 12 citacoes de linha corrigidas). PORTAO DA FASE 1: decidido pelo orquestrador sob a instrucao do proprietario de 2026-10-31 (prompt da microfase 01); ratificacao literal pendente no PR."
  },
  "plan": {
    "status": "approved",
    "approved_at": "2026-10-31",
    "notes": "plan.md do tech-lead (Fable 5.1, 2026-10-31): desenho B (fonte unica em ui_curation_v32.js, bridge __CURATION ganha oferta()/vetos()/reconcile()), boundary produto+generated, zero frozen; R9: ui_curation 316->~495, ui_p52_support 872->~940 justificado (a demanda retira derivacao); waves W0-W6; harness d026 na W4 (IC-4). Repins consolidados pelo orquestrador em tres (apos red, apos rebuild da W3, no fecho) em vez dos nove previstos — R8 exige o mesmo PR, nao um commit por wave (diretriz 2026-09-13). PORTAO DA FASE 2: decidido pelo orquestrador sob a instrucao do proprietario de 2026-10-31 (prompt da microfase 01); ratificacao literal pendente no PR."
  },
  "tasks": {
    "status": "approved",
    "approved_at": "2026-10-31",
    "notes": "tasks.md do tech-lead (Fable 5.1, 2026-10-31): T001-T069, W0-W6, tipagem auditavel (4 feature: T010, T020, T030, T031), estado do mundo M1..M6 corrigido pela critica (M1 nao derruba C7 (d); M5 sem FortiEndpoint de volta). T030/T031 executadas em sequencia na pasta primaria (um escritor por vez) em vez de worktrees paralelas — ganho de D-9 (+8 linhas) nao paga a junção. PORTAO DA FASE 3: decidido pelo orquestrador sob a instrucao do proprietario de 2026-10-31 (prompt da microfase 01); ratificacao literal pendente no PR."
  },
  "red": {
    "status": "proven",
    "commit": "7678222fdff654640653d0093c51383a48032ace",
    "gates": [
      "D026-REC1",
      "D026-PAP1",
      "D026-LEG1"
    ],
    "notes": "RED PROVADO pelo qa-engineer (Fable 5.1) em 2026-10-31 e reexecutado pelo orquestrador: D026 CONTRATO: 0 PASS · 3 FAIL de 3 (REC1 cai em (a) por __CURATION.oferta ausente; PAP1 cai em (a) C5 0/9 pr-card com tier; LEG1 cai em (a) por contrato ausente). Nascem verdes sem os atributos novos (declarado em red-026.md): REC1 (h), LEG1 (b), LEG1 (d) e metades puras de REC1 (g), LEG1 (a), LEG1 (c)-C3, LEG1 (f). SHA-256 do tests_026_contrato.js: 14d0dcf9e7d3fa1f3f45288f220a9cf519bdfbcdddc0f03e6d296974f27d9047. Regressao: d019 14/14, d022 14/14, d023 9/9, d025 16/16. T011 pareamento.md em 4041ec7 (forticlient -> FortiEndpoint pela regra 3; PAR-4 cadeia esgotada cai para a 3; PAR-5 family null nao aplica a 3 — decididas pelo orquestrador para o core)."
  },
  "implement": {
    "status": "done",
    "waves_done": [
      0,
      1,
      2,
      3,
      4,
      5,
      6
    ],
    "pending": [],
    "notes": "W2 fechada em 2026-10-31 (core-engineer, Fable 5.1): ui_curation_v32.js 316->597 linhas (acima dos ~495 do plano, abaixo do teto R9; contagem medida a registrar no relatorio). Desvios declarados e ACEITOS pelo orquestrador como erratas da spec (registrar em W6): (a) entradaViva() traz solucoes{capId->[{product,status,deployment}]} para existente[]; (b) veto ganha notas[]; (c) \"sinal requerido ausente\" e abstencao (hipotese), nao veto; (d) laco por sinal roda tambem sob suficiencia fechada (status quo 022); (e) veto.itemId = primeira oferta relacionada nao-family; (f) __P50SUFF ausente => suficiente=false; (g) entrada nula => coletar(true) com console.error. tasks.md T020 diz preflight d023 11/11; o harness tem 12 mutantes (12/12). W3a fechada (ui-engineer, Fable 5.1): ui_p52_support_v32.js 872->1105 linhas (acima dos ~940 do plano: crescimento do estouro herdado, registrar no relatorio), CSS +67 so p53-*; D026 3/3; literais novos ACAO_TXT/CONDICAO_TXT/VETO_TXT conferidos contra tests_*.js e P52_COPY (desvio declarado: \"Acao sugerida:\" no lugar de \"Proximo passo\", observavel de P52-RES4/U15). d014 regra_morta 4/3 por censo do CSS 33->52 regras: repin por execucao na W4. W3b fechada (ui-engineer, sonnet): editor +8 linhas, D-9. Repin R2 consolidado apos W3. W4 (QA): D022-M10 reancorado (4 toques), trilha E13, harness d026 + registros, censo do CSS remedido 52/298/5; campanhas d019 17, d022 13, d023 12, d025 23; d026 5/1 (D026-M5 sobrevivente: gate cego ao estado hipotese+veto na mesma chave do lado produto) -> W4b alinea REC1 (j) com fixture C4-DL, d026 6/0. W5: nota __CURATION em bridges.json. W6: EA-76 resolvido, EA-122/EA-123 abertos, erratas E1-E12, relatorio final."
  },
  "validate": {
    "status": "done",
    "conformance": "125/125 (100%) — iteracao 2 (0768076) apos erratas E13/E14; iteracao 1 = 123/125 (0bdfcfe; G1 trilha de temVoz unilateral, G2 literais de motivo no owner — ambos spec-errada)",
    "aceite_po": "NAO ENCONTREI OBJECAO — product-owner (lente), Fable 5.1, 2026-10-31, segundo passe sobre 5d9bdff. Primeiro passe reprovou nomeando O-1 (C3 do plano nao resolvido com D-3=false): acolhida pelo orquestrador — iteracao unica da Fase 6: red 6122bb7 (LEG1 (c) reancorada, 2/3), green 860735a (CONTEXTO_SUPRIMIDO_POR_PLATAFORMA = true, 3/3), campanha d026 6/0, errata E15. Observacoes (a)(b)(c) com rota registradas no relatorio.",
    "aprovacao_de_fase": "Portoes das Fases 0-3 e as decisoes D-1..D-9 (D-3 revertida para true na Fase 6): decidido pelo orquestrador sob a instrucao do proprietario de 2026-10-31 (prompt da microfase 01); ratificacao literal pendente no PR. A Fase 6 encerra com QA + PO (R4).",
    "notes": "Pipeline completo em arvore limpa (fca0e1c, 2026-10-31): run.sh 18 PASS · 0 FAIL (stage mutation incluso) e compliance-audit 17 PASS · 0 FAIL · 0 WARN. PR #117 aberto em rascunho em 2026-10-31 (fecho C8: Fase 6 completa + PR aberto; CI verde e condicao do merge, nao do done; \"pronto\" = job visual verde, KI-3). Merge e ratificacao literal de D-1..D-9 sao do proprietario (T069)."
  },
  "pr_url": "https://github.com/oflavioc/quickscan-secops/pull/117"
}
