{
  "demanda": "019-curadoria-do-relatorio",
  "phase": "specify",
  "spec_dir": "specs/019-curadoria-do-relatorio",
  "branch": "feature/019-curadoria-do-relatorio",
  "brief": "Achado EA-57 mais o feedback de 2026-09-15: o SE termina a sessao sabendo coisas que o screening nao sabe (o que o cliente ja contratou, o que esta em piloto, qual conversa esta madura) e nao tem onde colocar isso — o relatorio sai como o motor produziu, e a escolha e entregar assim ou reescrever fora da ferramenta. A demanda entrega uma tela de CURADORIA, depois dos resultados, onde o operador seleciona o subconjunto do que o motor produziu que vai ao relatorio, na tela E no PDF; e absorve a reorganizacao de 'Formas de apoio' por SOLUCAO, porque a curadoria precisa de uma lista de produtos para oferecer e essa lista e exatamente a visao por solucao. FRONTEIRA DURA: o operador escolhe entre o que o motor ofereceu, nunca escreve o que o motor deveria ter dito — e disso dependem as duas invariantes que a demanda tangencia (INV-7 determinismo, INV-8 derivado nunca serializado). Medido em 2026-09-17 sobre develop: sessao real de 15 respostas produz 15 blocos de apoio para 9 produtos distintos e 20 mencoes, com 'Servicos FortiGuard' aparecendo 5 vezes; a visao por solucao daria 9 cards. Aberta a pedido do proprietario; conducao sob a delegacao de 2026-08-29.",
  "refinement": {
    "status": "approved",
    "notes": "Fase 0 escrita pelo orquestrador NO CONTRATO do product-owner: os agentes de papel existem em .claude/agents/ mas NAO estao disponiveis como subagentes nesta sessao, e isso vai dito no artefato em vez de simulado (precedente da 018). O refinamento MEDIU o sistema real em vez de citar os achados. TRES MEDICOES QUE MUDAM O DESENHO: (1) captureCanonicalInputs() (ui_session_v32.js:58-68) devolve EXATAMENTE cinco chaves, e o gate S4-S5 (tests_session_m48.js:115) afirma essa lista por IGUALDADE EXATA de JSON, alem de proibir 13 nomes de campo derivado; tests_session_m48.js e §29.4 — logo persistir a curadoria como sexta chave toca DOIS arquivos protegidos mais o validador de importacao, e isso passou de estimativa a numero. (2) P52-REC1g (tests_p52_chromium.js:675) mede a GEOMETRIA dos .apoio-block e reprova 'cards em coluna unica no desktop' — ocultar os 15 blocos legados para mostrar 9 novos derruba o gate, entao a reorganizacao por solucao e reestruturacao e nao ajuste de CSS. (3) O produto JA carrega conteudo escrito pelo facilitador no relatorio (notes[k], impresso em ui_v32.js:1247 e :1345 como 'Observacoes da sessao') — ou seja, ja resolveu uma vez o problema de misturar voz humana e voz do motor, e resolveu ROTULANDO; a curadoria herda esse padrao. ENQUADRAMENTO: INV-7 e preservada porque determinismo e propriedade de (entradas)->saida e nao proibicao de entrada humana; INV-8 e preservada porque SELECAO e entrada, enquanto TEXTO escrito pelo operador seria derivado serializado. Dessa distincao sai a fronteira dura da demanda. Tres alternativas: (A) so melhorar o catalogo — nao basta, cobre 2 de 10 gaps no PDF medido (EA-56) e custa Porta B a cada ajuste (EA-58); (B) deixar editar o texto — RECUSADA, viola INV-8 e desmonta a garantia 'nenhum produto e inferido sem contexto'; (C) selecao sobre o que o motor produziu — a proposta. PORTAO PENDENTE DO USUARIO: cinco perguntas com recomendacao no refinement.md — P1 fronteira selecao-vs-edicao; P2 persistencia como sexta chave canonica; P3 forma da proveniencia no papel; P4 escopo da primeira entrega (so apoio); P5 se o apoio por solucao entra nesta demanda. R4: aprovacao e literal e do usuario, no chat — a delegacao de 2026-08-29 cobre a CONDUCAO dos portoes, e estas cinco sao decisoes de produto sobre o que a ferramenta passa a permitir. ARTEFATO: specs/019-curadoria-do-relatorio/refinement.md. ACHADO DE ORIGEM: EA-57; citados EA-55 (a redundancia medida), EA-56 e EA-58 (o catalogo represado atras de Porta B, que esta demanda reduz a urgencia sem resolver) e EA-62 (a familia de mudar o que nao se consegue medir). PORTAO FECHADO em 2026-09-17, com as cinco respondidas no chat e transcritas na secao 'Decisoes do portao da Fase 0' do refinement.md. P1: curadoria e SELECAO; o verbo 'adicionar' foi desdobrado em tres e o proprietario decidiu (a) SIM catalogo nao ofertado, (b) SIM fora do ofertado, (c) NAO texto livre ('esse e desnecessario') — com (c) fora, a INV-8 permanece intacta. P2: sim, sexta chave canonica. P3: rotulo por item, padrao 'Observacoes da sessao'. P4: confirmada a linha proposta — a curadoria age sobre o que o motor INFERIU, nunca sobre o que foi DECLARADO ou MEDIDO; gaps, prioridades e cenario-alvo ficam fora POR PRINCIPIO, e para desenfatizar um gap o caminho e a observacao. P5: entra, agrupado pela divisao oficial do portfolio. CONHECIMENTO DO PROPRIETARIO REGISTRADO: FortiEDR e FortiClient continuam comercializados separadamente; a ausencia na navegacao publica e decisao de divulgacao e nao descontinuacao — eu havia lido a ausencia como sinal de que o item 8 pedia nomes superados, e estava errado. MEDICAO QUE FECHA A ROTA (ii), feita em COPIA sem tocar a arvore (R7 §3): acrescentar QUALQUER produto ao PRODUCTS altera o payload M41, logo e Porta B sem excecao. A causa nao e o mapeamento — candidatesMatrix() percorre as perguntas e le o MAP, e produto sem mapeamento nao entra nela; quem muda e o configErrors, porque a validacao da Camada 1 (quickscan_secops_soccmm_v3_1_3.html:1088) exige entrada no ICONS DA CAMADA 1, e o acervo onde FortiEDR/FortiClient existem e o ICONS_V32, que e outro mapa. Duas sondas, com e sem icone no acervo v3.2, divergiram pela mesma linha. CONSEQUENCIA: a rota (i) — oferecer todo o catalogo existente — e a unica livre, e a demanda fica pronta para os tres faltantes (FortiNAC, FortiEDR, FortiClient) chegarem pela Porta B do EA-56 sem mudanca de codigo, porque a curadoria le o catalogo.",
    "approved_at": "2026-09-17"
  },
  "specify": {
    "status": "pending"
  }
}
